{
  "schemaVersion": 1,
  "kind": "hvm-compat-report",
  "generatedAt": "2026-10-22T13:52:59+00:00",
  "git": {
    "commit": "cb3509e234ae4b83452ce55bbee76935d9fa281d",
    "short": "cb3509e234ae",
    "branch": "codex/zip-entry-bounds",
    "dirty": false
  },
  "host": {
    "system": "Linux",
    "release": "6.18.55",
    "machine": "x86_64",
    "python": "3.12.14",
    "pageSize": 4096,
    "compiler": "Ubuntu clang version 18.1.3 (1ubuntu1)",
    "notes": [
      "Host page size is the kernel page. Guest permissions are 4 KB and are not enforced on the fast path.",
      "A pass recorded here is not a 16 KB iOS memory-model pass."
    ]
  },
  "limits": {
    "runsOnLinuxHeadless": [
      "cmake/ninja build of hvm, hvm_tests, hvm_decodecheck",
      "hvm_tests selftest and fulltest",
      "asm and differential C guests (tools/build_tests.sh, ld.lld, armv7 clang)",
      "python tools/tests/test_verify_ipa.py and the Clash protocol/home fixture tests",
      "hvm run of decrypted IPAs with a software framebuffer, PNG screenshot, and JSON report",
      "mixer levels when a datagram socket is passed as --audio-fd (no sound device)"
    ],
    "notRunHere": [
      "Xcode, SwiftUI app/, simulator (tools/sim_test.sh), device signing, entitlements, Metal",
      "iOS stub-SDK guests and CoreMark, which need ld64 from tools/build_cctools.sh",
      "Clash Royale native two-launch probe; the IPA is not in git and this harness does not download it",
      "16 KB host-page memory model (this report records the host page size and does not claim an iPhone pass)",
      "pygame desktop viewer (tools/desktop.py), which needs a display",
      "Unconditional macOS Actions. Linux CI and the compat harness passed on 6af9976; the empty-step failure on 07fabbb (run 39633887764) was real. The macOS job still runs only for [mac], workflow_dispatch, or the Monday schedule"
    ]
  },
  "manifest": {
    "path": "tools/compat_harness/manifests/apps.json",
    "schemaVersion": 1,
    "fixtureRoot": null,
    "legacyRepoAllowed": true
  },
  "suites": {
    "unit": {
      "status": "pass",
      "passed": 16,
      "failed": 0,
      "cases": [
        {
          "id": "selftest",
          "status": "pass",
          "exitCode": 0,
          "durationSec": 0.037,
          "summary": "selftest passed: exit=2 result=0xA05A0848 expected=0xA05A0848, 10.0 M insns in 0.023 s (437 MIPS)"
        },
        {
          "id": "fulltest",
          "status": "pass",
          "exitCode": 0,
          "durationSec": 2.431,
          "summary": "max, and the 16.7 ms slow threshold; the first present wins\n  ok   two-frame percentiles come from the histogram, not from max or the average\n  ok   perf JSON adds percentile and time-to-first-frame fields without changing legacy ones\nfulltest: 191 passed, 0 failed\nLoopback resolver refused host: 192.0.2.1\n[warn] GLSL shader 5: unknown variable/function missing near token 10 (';')\n[warn] GLSL program 3: attached shader not compiled\n[warn] GLSL program 7: instruction budget exceeded; draw aborted"
        },
        {
          "id": "asm:arm_alu",
          "status": "pass",
          "exitCode": 0,
          "durationSec": 0.01,
          "summary": "asm build/tests/arm_alu.elf                  40 passed, 0 failed"
        },
        {
          "id": "asm:arm_mem",
          "status": "pass",
          "exitCode": 0,
          "durationSec": 0.014,
          "summary": "asm build/tests/arm_mem.elf                  17 passed, 0 failed"
        },
        {
          "id": "asm:thumb",
          "status": "pass",
          "exitCode": 0,
          "durationSec": 0.016,
          "summary": "asm build/tests/thumb.elf                    30 passed, 0 failed"
        },
        {
          "id": "asm:vfp_neon",
          "status": "pass",
          "exitCode": 0,
          "durationSec": 0.016,
          "summary": "asm build/tests/vfp_neon.elf                 23 passed, 0 failed"
        },
        {
          "id": "c:ctests_arm",
          "status": "pass",
          "exitCode": 0,
          "durationSec": 0.046,
          "summary": "c   build/tests/ctests_arm.elf               27 passed, 0 failed (2649603 guest insns, 151 blocks)"
        },
        {
          "id": "c:ctests_arm_os",
          "status": "pass",
          "exitCode": 0,
          "durationSec": 0.051,
          "summary": "c   build/tests/ctests_arm_os.elf            27 passed, 0 failed (2658062 guest insns, 151 blocks)"
        },
        {
          "id": "c:ctests_thumb",
          "status": "pass",
          "exitCode": 0,
          "durationSec": 0.053,
          "summary": "c   build/tests/ctests_thumb.elf             27 passed, 0 failed (2542944 guest insns, 154 blocks)"
        },
        {
          "id": "c:ctests_thumb_os",
          "status": "pass",
          "exitCode": 0,
          "durationSec": 0.033,
          "summary": "c   build/tests/ctests_thumb_os.elf          27 passed, 0 failed (2438787 guest insns, 153 blocks)"
        },
        {
          "id": "c:ctests_thumb_idiv",
          "status": "pass",
          "exitCode": 0,
          "durationSec": 0.042,
          "summary": "c   build/tests/ctests_thumb_idiv.elf        27 passed, 0 failed (2437815 guest insns, 147 blocks)"
        },
        {
          "id": "c:ftests_vfp_arm_hard",
          "status": "pass",
          "exitCode": 0,
          "durationSec": 0.122,
          "summary": "c   build/tests/ftests_vfp_arm_hard.elf      29 passed, 0 failed (717177 guest insns, 164 blocks)"
        },
        {
          "id": "c:ftests_vfp_thumb_softfp",
          "status": "pass",
          "exitCode": 0,
          "durationSec": 0.022,
          "summary": "c   build/tests/ftests_vfp_thumb_softfp.elf  29 passed, 0 failed (725161 guest insns, 161 blocks)"
        },
        {
          "id": "c:ftests_neon_thumb",
          "status": "pass",
          "exitCode": 0,
          "durationSec": 0.017,
          "summary": "c   build/tests/ftests_neon_thumb.elf        29 passed, 0 failed (671485 guest insns, 173 blocks)"
        },
        {
          "id": "c:ftests_neon_arm",
          "status": "pass",
          "exitCode": 0,
          "durationSec": 0.022,
          "summary": "c   build/tests/ftests_neon_arm.elf          29 passed, 0 failed (662472 guest insns, 171 blocks)"
        },
        {
          "id": "c:ftests_neon_thumb_os",
          "status": "pass",
          "exitCode": 0,
          "durationSec": 0.019,
          "summary": "c   build/tests/ftests_neon_thumb_os.elf     29 passed, 0 failed (696531 guest insns, 160 blocks)"
        }
      ]
    },
    "python": {
      "status": "pass",
      "passed": 3,
      "failed": 0,
      "cases": [
        {
          "id": "verify_ipa",
          "status": "pass",
          "exitCode": 0,
          "durationSec": 0.116,
          "summary": "......\n----------------------------------------------------------------------\nRan 6 tests in 0.005s\n\nOK"
        },
        {
          "id": "clash_protocol",
          "status": "pass",
          "exitCode": 0,
          "durationSec": 0.12,
          "summary": "......\n----------------------------------------------------------------------\nRan 6 tests in 0.007s\n\nOK"
        },
        {
          "id": "clash_home_state",
          "status": "pass",
          "exitCode": 0,
          "durationSec": 0.129,
          "summary": "......\n----------------------------------------------------------------------\nRan 6 tests in 0.008s\n\nOK"
        }
      ]
    },
    "fuzz": {
      "status": "not-run",
      "reason": "pass --fuzz N to sample the decoder",
      "cases": []
    },
    "apps": {
      "status": "partial",
      "hvm": "build/hvm",
      "apps": [
        {
          "id": "angry-birds",
          "name": "Angry Birds",
          "version": "1.0",
          "optional": false,
          "sha256": "cdea1290dcaa67ec75cf555e78caaa8d90cfaa90021ec7f05e40089fb87944cf",
          "source": "legacy-repo",
          "displayPath": "AngryBirds_v1.0_os30.ipa",
          "status": "ran",
          "reason": "",
          "launchSuccess": true,
          "crashed": false,
          "exitStatus": 0,
          "stillRunning": true,
          "loadError": "",
          "unimplementedImports": [],
          "missingFunctions": [],
          "warnings": [],
          "errors": [],
          "crashReport": "",
          "perf": {
            "wallSeconds": 3.122,
            "guestInstructions": 37975959,
            "guestMIPS": 12.162,
            "blocksDecoded": 4790,
            "frames": 43,
            "framesPresented": 43,
            "avgFrameMs": 49.066,
            "avgCompositeMs": 47.905,
            "maxFrameMs": 121.436,
            "slowFrames": 43,
            "p50FrameMs": 44.565,
            "p95FrameMs": 94.372,
            "p99FrameMs": 120.586,
            "timeToFirstFrameMs": 319.442
          },
          "frame": {
            "signal": "mostly-one-color",
            "width": 640,
            "height": 960,
            "sampled": 9600,
            "blackFraction": 0.0077,
            "whiteFraction": 0.9348,
            "otherFraction": 0.0575,
            "uniqueQuantizedColors": 41,
            "dominantShare": 0.9349,
            "framesPresented": 43
          },
          "audio": {
            "measured": true,
            "signal": "silent",
            "setupError": "",
            "enabled": true,
            "frames": 135168,
            "nonSilentFrames": 0,
            "peak": 0,
            "droppedBlocks": 0,
            "transportError": 0
          },